"link"|"place_name"|"city_name"|"price_by_night"|"rating"|"address"|"images"|"amenities"|"description"|"thirdparty"
"https://us.trip.com/hotels/guilin-hotel-detail-82628649/shixi-landscape-hotel/?cityId=871&checkIn=2022-01-22&checkOut=2022-01-23&adult=2&children=0&crn=1&ages=&travelpurpose=0&curr=USD&link=title&hoteluniquekey=H4sIAAAAAAAAAOOawsTFK8Fk8B8GGIWYOBil_jFyXFz1azWLxa0IRwYQ2FDv4AlmXGh2COApBDMTSh0aGb9pxPQfUi1ymMQYxwkWbehzEDx7BgjedDooOXP8mvGdW4BNYvvGozIKjJowfYYwhgWrI8wETxgjiJWjW0uCJYqNY_ZPaQkOJ1aO-RUSLDMYVy7YrL6CkXEjI1jzgXiHHYxMJxgDFjCd375ZfRcTRNkhIH2DX4LlFBPDJSaGW0wMj5ggxr1iYvjEBDXyF1RxEzNDFzPDJGaIllnMEJWLmBmEWMHel1JINjRMNU0xNjBNNTczMTBKSUoyNUixMDFPNTOyTDS0NFLg1jh8b2U_mxGDFbMUo5sHYxCbq6OBoblZlAwXs7NfpCDYrQwf7KWYQ4NdFKO-7rzVFSvpkMSamqcbGpxxl6OAsYuRTYDRgzGCcRUjAwD5DBY_jwEAAA"|"Shixi Landscape Hotel"|"Guilin"|"80"|"4.8"|"Building B, No.30 Guanlian Road, Yangshuo, Guangxi, China"|"[""https://ak-d.tripcdn.com/images/020161200095159sw8A34_R_600_400_R5_D.jpg_.webp"", ""https://ak-d.tripcdn.com/images/020681200095163a8780F_R_800_525_R5_D.jpg"", ""https://ak-d.tripcdn.com/images/02015120009518q1cFFBB_R_800_525_R5_D.jpg""]"|"Wi-Fi in designated areasRestaurantCaféBarNon-smoking floor"|"Opened: 2021 Opened in 2021, the Shixi Landscape Hotel is a great accommodation choice in Yangshuo."|"trip.com"
"https://us.trip.com/hotels/guilin-hotel-detail-437341/guilin-yiyuan-boxin-senshe/?cityId=33&checkIn=2022-01-22&checkOut=2022-01-23&adult=2&children=0&crn=1&ages=&travelpurpose=0&curr=USD&link=title&hoteluniquekey=H4sIAAAAAAAAAOO6z8jFK8Fk8B8GGIWYOBilTjJyrHxyay2LIwMI3Gh18AQzVnQ6BPAUgpkOMQ6TGO04wWyDXgclHY4PnY08AmwSRz_flFFg1IQpMoQxLN4yBrFyvOCVYIlicGLl6CyWYJnBePeG1EZGsIqGOIcdjEwHGJlOMOYtYNr7m20XE0TRISDdyC_BcoqJ4RITwy0mhkdMEGNeMTF8YmL4BVXWxMzQxcwwiRmieBYzRM0iZgYhVrBPpBSSDQ1TTVOMDUxTzc1MDIxSkpJMDVIsTMxTzYwsEw0tjRS4NQ7fW9nPZsRgxSzF6ObBGMTm4uxkZmIaJcPF7OwXKQh2J8MHeynm0GAXxaivO291xUo6JLGm5umGBmfc5Shg7GJkE2D0YIxgXMXIAAALJqT9WgEAAA"|"Guilin Yiyuan Boxin Senshe"|"Guilin"|"110"|"4.7"|"117 West Huancheng 1st Road (Huancheng Xi Yi Lu), Guilin, 541002, Guangxi, China"|"[""https://ak-d.tripcdn.com/images/0204i12000987rnkl9DED_R_600_400_R5_D.jpg_.webp"", ""https://ak-d.tripcdn.com/images/0204k12000987vixr2A28_R_800_525_R5_D.jpg"", ""https://ak-d.tripcdn.com/images/0201n12000987s8sfB142_R_800_525_R5_D.jpg""]"|"Wi-Fi in designated areasRestaurantCaféNon-smoking floorFront desk (24 hours)"|"Opened: 2011 Lin Biao. The Royal B&B is located in the Black Mountain Garden Botanical Garden, which is known as the “Xishuangbanna of Guilin”. It is hidden between the pines and the clear waters. The architectural style is simple and elegant, and it blends perfectly with the scenery in the garden.  It is a three-minute drive from the South Railway Station, a twenty-five-minute drive from the airport, a 10-minute drive from the Xianghong Mountain, Dongxiang Alley, Jingjiang Wangfu and the city center. It is a short walk to the large commercial plaza of the Garden Gate!  The hotel has 63 rooms, with 10 different kinds of room types for you to choose from. Whether you are a couple, girlfriends, family fun, class reunion, company group building, there is always one for you!  The interior of the room is simple and elegant, leaning against the window overlooking the window, taking a breath of fresh air from the oxygen bar, listening to a mountain of songbirds, enjoying the elegance of the mountain hidden forest, savoring your uniqueness, feeling ""returning to the peak like a scorpion""  Your nervous mood is relieved!  The hotel is located in 300 acres of forest, equipped with modern ultra-wide pool, style water bar, barbecue area, chess room, etc., and planted more than 10 kinds of fruit trees such as mulberry, bayberry, plantain and persimmon in the garden, which can be enjoyed during the harvest season.  Delicious fruit!  Each guest has a 24-hour intimate butler service. They are good guides, can provide you with subtle and exquisite services, and can help you plan your travel route for free, so that you can enjoy the local culture and experience more completely!"|"trip.com"
"https://us.trip.com/hotels/kunming-hotel-detail-66727095/hampton-by-hilton-kunming-guandu/?cityId=34&checkIn=2022-01-22&checkOut=2022-01-23&adult=2&children=0&crn=1&ages=&travelpurpose=0&curr=USD&link=title&hoteluniquekey=H4sIAAAAAAAAAOOazsTFK8Fk8B8GGIWYOBilGpk4Nk2Zd5rZ4laEIwMIONQ7eIIZG5ocAngKwcwDSQ6NjFzXFxfYnop3mMQYxwkWTWh3EEwDgXvNDkrOHH1XJ7ILsElcmfRGQIFRE6bPEMawYHWEmeAJYwSxcrxhlGCKYuM4O49HgsOJlWNKjATLDMbtN1_Ir2Bk3MgI1twQ4bCDkekAI9MJRv8FTPuBcruYICoPAelmHgmWU0wMl5gYbjExPGKCmPiKieETE9TUX1DFTcwMXcwMk5ghWmYxQ1QuYmYQYgWHgJRCsrGRuaGxkYmZhWWiibFpaqJhUqJJkoGpUUqiRYpZmrECt8baByv72YwYrJilGN08GIPYjCxMXI0tomS4mJ39IgXBzmX4YC_FHBrsohj1deetrlhJhyTW1Dzd0OCMuxwFjF2MbAKMHowRjKsYGQDVWqlKkgEAAA"|"Hampton by Hilton Kunming Guandu"|"Kunming"|"79"|"4.8"|"No.488 Huancheng East Road, Kunming, Yunnan, China"|"[""https://ak-d.tripcdn.com/images/0204h1200081zxaiuF0AD_R_600_400_R5_D.jpg_.webp"", ""https://ak-d.tripcdn.com/images/0202p1200081zy7ze6181_R_800_525_R5_D.jpg"", ""https://ak-d.tripcdn.com/images/0201t1200083d4wwkE9C9_R_800_525_R5_D.jpg""]"|"Wi-Fi in designated areasRestaurantCaféBarNon-smoking floor"|"Opened: 2020 Opened in 2020, the Hampton by Hilton Kunming Guandu is a great accommodation choice in Kunming."|"trip.com"
"https://us.trip.com/hotels/kunming-hotel-detail-5266789/kunming-lianhang-hotel-changshui-international-airport/?cityId=34&checkIn=2022-01-22&checkOut=2022-01-23&adult=2&children=0&crn=1&ages=&travelpurpose=0&curr=USD&link=title&hoteluniquekey=H4sIAAAAAAAAAONaw8jFK8Fk8B8GGIWYOBilpjFy7H678guzIwMILMhw8AQzHHIcAngmMUpywniCZ8-AQJqDEyvHG2kJlhmMT3cdZFrByLiREayEwdZhByPzAUamE4zyC5juPD3KtIsJovIQkL7ILMFyionhEhPDLSaGR0wMr5gYPjEx_IKqaGJm6GJmmMQMUTeLmWERM4MQK9hZUgrJxkbmhsZGJmYWlokmxqapiYZJiSZJBqZGKYkWKWZpxgrcGmsfrOxnM2KwYpZidPNgDGIzMXUzMrSIkuFidvaLFIQ474O9FHNosIti1Nedt7piJR2SWFPzdEODM-5yFDB2MbIJMHowRjCuYmQAAOn0EXInAQAA"|"Kunming Lianhang Hotel (Changshui International Airport)"|"Kunming"|"24"|"4.6"|"Industrial Park, Banqiao Community, Kunming, 650000, Yunnan, China"|"[""https://ak-d.tripcdn.com/images/0201v1200055iammc6F44_R_600_400_R5_D.jpg_.webp"", ""https://ak-d.tripcdn.com/images/0206p120008a9stk119D5_R_800_525_R5_D.jpg"", ""https://ak-d.tripcdn.com/images/020211200055tmul71E29_R_800_525_R5_D.jpg""]"|"Wi-Fi in designated areasAirport pickup serviceRestaurantFront desk (24 hours)Wake-up call"|"Opened: 2020 The Kunming United Airlines hotel is located in the airport economic and industrial park next to the Kunming Changshui International Airport, just seven minutes'drive from the Kunming Changshui International Airport, the hotel has five-seater Suvs, seven-seater luxury business vehicles, 17-seater environment-friendly electric vehicles, thirty-five-seater tourist buses and other special vehicles, and Free Airport pick-up and drop-off machines. The hotel facilities are configured and arranged in strict accordance with the four-star standard, combined with the innovative concept of the hotel, the 10-storey building has a total of 168 rooms and is equipped with a generator that will not cut off power, 24-hour hot water, elevators, air conditioning, conference rooms, restaurants, free parking and wi-fi coverage. Around the hotel has Yunnan Specialty Food, KTV, foot therapy, bars, night market and other streets. The hotel has convenient transportation. Beside the hotel, you can take the subway, bus or bus to Nanping Street, Dian Lake, Minzu Village, Expo Park, city of flowers, Shilin, Jiuxiang and other tourist attractions. Kunming United Airlines hotel is your journey to stay in the warm harbor"|"trip.com"
"https://us.trip.com/hotels/kunming-hotel-detail-428203/kai-wah-plaza-hotel/?cityId=34&checkIn=2022-01-22&checkOut=2022-01-23&adult=2&children=0&crn=1&ages=&travelpurpose=0&curr=USD&link=title&hoteluniquekey=H4sIAAAAAAAAAONaxsjFK8Fk8B8GGIWYOBilJjByNEyY-I7ZkQEENpQ6eIIZHyocAngmMUpywniCaSBgVOrgxMoxxVCCZQbj6olSKxgZNzKCVTB4OexgZDrBaL6A6ZfYLiaImkNAeiubBMspJoZLTAy3mBgeMTG8YmL4xMTwC6qiiZmhi5lhEjNE3SxmhkXMDEKsYAdJKSQbG5kbGhuZmFlYJpoYm6YmGiYlmiQZmBqlJFqkmKUZK3BrrH2wsp_NiMGKWYrRzYMxiM3QxdnRwCRKhovZ2S9SEOKyD_ZSzKHBLopRX3fe6oqVdEhiTc3TDQ3OuMtRwNjFyCbA6MEYwbiKkQEACXrDjyEBAAA"|"Kai Wah Plaza Hotel"|"Kunming"|"55"|"4.7"|"No. 157 Beijing Road, Kunming, 650011, Yunnan, China"|"[""https://ak-d.tripcdn.com/images/200i13000000tdrkpC31C_R_600_400_R5_D.jpg_.webp"", ""https://ak-d.tripcdn.com/images/200w15000000ynz3y2CE6_R_800_525_R5_D.jpg"", ""https://ak-d.tripcdn.com/images/20050f0000007fi09B785_R_800_525_R5_D.jpg""]"|"Wi-Fi in designated areasAirport shuttle serviceAirport pickup serviceRestaurantCafé"|"Opened: 1999 Kunming's Kai Wah Plaza International Hotel (Kunming Jiahua Guangchang Jiudian) is a five-star deluxe business hotel located in the city's commercial center, also within easy access to both the railway station and the airport.   Comfortable guestrooms in this Chongqing hotel come outfitted with international direct dial telephones, internet access, safes, air conditioning, satellites TVs and mini-bars. Additionally, there are non-smoking rooms and handicapped-friendly facilities.  The on-site Chinese restaurant serves decent Cantonese cuisine as well as local dishes.   Equipped with top conference equipments, the 800 square meter banquet hall and 11 multi-function rooms make this hotel a venue for conferences, private parties, or other social events."|"trip.com"
"https://us.trip.com/hotels/kunming-hotel-detail-66732392/mehood-lestie-hotel-kunming-gaoxin/?cityId=34&checkIn=2022-01-22&checkOut=2022-01-23&adult=2&children=0&crn=1&ages=&travelpurpose=0&curr=USD&link=title&hoteluniquekey=H4sIAAAAAAAAAONaz8jFK8Fk8B8GGIWYOBilZjJyrNy8-zOzxa0IRwYQ2FDh4AlmJNQ4BPBMYpTkhPEEg3bItb4WrXBwYuX4bi7BMoPxRdNL-RWMjBsZwUoafB12MDIdYGQ6wWi3gOkDUG4XE0TlISC9jF2C5RQTwyUmhltMDI-YGF4xMXxiYvgFVdHEzNDFzDCJGaJuFjPDImYGIVawy6QUko2NzA2NjUzMLCwTTYxNUxMNkxJNkgxMjVISLVLM0owVuDXWPljZz2bEYMUsxejmwRjEZm7u4mLiGCXDxezsFykIdh7DB3sp5tBgF8WorztvdcVKOiSxpubphgZn3OUoYOxiZBNg9GCMYFzFyAAARUbcdioBAAA"|"Mehood Lestie Hotel (Kunming Gaoxin)"|"Kunming"|"62"|"4.8"|"Building 3, No.999 Haiyuan North Road, Kunming, Yunnan, China"|"[""https://ak-d.tripcdn.com/images/0205112000812swis5309_R_600_400_R5_D.jpg_.webp"", ""https://ak-d.tripcdn.com/images/0202p12000811yawlAD6B_R_800_525_R5_D.jpg"", ""https://ak-d.tripcdn.com/images/020691200082t5cbm5D4F_R_800_525_R5_D.jpg""]"|"Wi-Fi in designated areasRestaurantCaféBarNon-smoking floor"|"Opened: 2020 The Mehood Lestie Hotel (Kunming Gaoxin) is a great choice for guests looking for accommodation in Kunming, having been recently opened in 2020."|"trip.com"
"https://us.trip.com/hotels/kunming-hotel-detail-2707235/howard-johnson-flower-city-hotel-kunming/?cityId=34&checkIn=2022-01-22&checkOut=2022-01-23&adult=2&children=0&crn=1&ages=&travelpurpose=0&curr=USD&link=title&hoteluniquekey=H4sIAAAAAAAAAOOawsjFK8Fk8B8GGIWYOBil6jn6Fqx_yezIAAIBRQ6eMEYAzyRGSU4YT9AYBJzzHZxYOc4xSzDNYFw8bynjCkbGHYxMJxj1FjCtA3J3MUEkDzExnGJiuMTEcIuJ4RETwysmhk9MDL-gkk3MDF3MDJOYGWYxMyxiZhBiBdsvpZBsbGRuaGxkYmZhmWhibJqaaJiUaJJkYGqUkmiRYpZmrMCtsfbByn42IwYrZilGNw_GIDZjExNHR6coGS5mZ79IQbBTGT7YSzGHBrsoRn3deasrVtIhiTU1Tzc0OOMuRwFjFyObAKMHYwTjKkYGAGaSU30PAQAA"|"Howard Johnson Flower City Hotel Kunming"|"Kunming"|"46"|"4.7"|"No.8188 Jinwa Road, Kunming, 650000, Yunnan, China"|"[""https://ak-d.tripcdn.com/images/0202q120008th82d3F34A_R_600_400_R5_D.jpg_.webp"", ""https://ak-d.tripcdn.com/images/0204f120008th895t497C_R_800_525_R5_D.jpg"", ""https://ak-d.tripcdn.com/images/02001120008th8xmfC238_R_800_525_R5_D.jpg""]"|"Wi-Fi in designated areasRestaurantNon-smoking floorFront desk (24 hours)Wake-up call"|"Opened: 2015 Howard Johnson City of Flower Hotel Kunming Orchid Yuan locates near Changshui international airport, which is about 15 minutes away by car. Dining choices include Chinese and Western restaurants. Business travelers will find meeting facilities and a business center at their disposal. Guests can enjoy free parking and Wi-Fi access in public areas. Hotel provide airport shuttle services. Drop off time, 9:00～20:00, departs at every clock. Pick up time，10:00～21:00, departs at every clock. Shuttle service is complimentary in some price packages. For the price packages without complimentary shuttle bus, you need to pay CNY 25 per person once. For more information, please call 86 0871 65036999."|"trip.com"
"https://us.trip.com/hotels/xishuangbanna-hotel-detail-852296/rumo-yulin-garden-holiday-villa-xishuangbanna-xingguang-night-market/?cityId=309&checkIn=2022-01-22&checkOut=2022-01-23&adult=2&children=0&crn=1&ages=&travelpurpose=0&curr=USD&link=title&hoteluniquekey=H4sIAAAAAAAAAOP6w8jFK8Fk8B8GGIWYOBilnjFyLJzyjNXgLpcjAwgsyHXwhDECeArBzAfJDo2MIuvcH1ZdSXCYxBjPCRY9UOEgOGsmEHCWOii5cGycu4VdgE1i-d97ggqMmjB9hjCGxTE2R5gRnjBGECvHIWEJlig2jg9LGSXYnFg5nhpIsMxgPNFksoOR6QSj6gKml5eaGHcxQSQOMTGcYmK4xMRwi4nhERNE7ysmhk9MUP2_oOqamBm6mBkmMTPMYoYoWsTMIMQC8qaUgoWpWbJ5akpSqlFymomxUVpiSnKigVGyQUpiqqlFsqWlArfGo4cr-9mMGKyYpRjdPBiD2IwsTR0NTKNkuJid_SIFwR5i-GAvxRwa7KIY9XXnra5YSYck1tQ83dDgjLscBYxdjGwCjB6MEYyrGBkAbmrwbnYBAAA"|"Rumo Yulin Garden Holiday Villa (Xishuangbanna Xingguang Night Market)"|"Xishuangbanna"|"37"|"4.8"|"Tower 20,Jingfa Village,Gaozhuang Xishuangjing,Jinghong City,Xishuangbanna,Yunnan,China, Jinghong, 666101, Yunnan, China"|"[""https://ak-d.tripcdn.com/images/0201f120008t2hshiF7B1_R_600_400_R5_D.jpg_.webp"", ""https://ak-d.tripcdn.com/images/0202y120008t2i2x7D4C9_R_800_525_R5_D.jpg"", ""https://ak-d.tripcdn.com/images/0201z120008rxstreE1C1_R_800_525_R5_D.jpg""]"|"Wi-Fi in designated areasAirport pickup serviceRestaurantCaféNon-smoking floor"|"Opened: 2019 The Rumo Yulin Garden Holiday Villa (Xishuangbanna Xingguang Night Market) is a great choice for guests looking for accommodation in Jinghong, having been recently opened in 2019."|"trip.com"
"https://us.trip.com/hotels/xishuangbanna-hotel-detail-6803811/lancang-river-bank-resort/?cityId=309&checkIn=2022-01-22&checkOut=2022-01-23&adult=2&children=0&crn=1&ages=&travelpurpose=0&curr=USD&link=title&hoteluniquekey=H4sIAAAAAAAAAONaw8jFK8Fk8B8GGIWYOBilpjFy9J5evprFoqHCkQEEFHIcPMEMgwKHAJ5JjJKcMJ7gkgJbruuLsxycWDm-yEuwzGB8vGg-80ZGsDyDo8MORqYDjEwnGFUWMP041q2xiwmi7BCQnsoiwXKKieESE8MtJoZHTAyvmBg-MTH8gqpoYmboYmaYxAxRN4uZYREzgxAr2FlSChamZsnmqSlJqUbJaSbGRmmJKcmJBkbJBimJqaYWyZaWCtwajx6u7GczYrBilmJ082AMYnMxdTEzMo6S4WJ29osUhDjvg70Uc2iwi2LU1523umIlHZJYU_N0Q4Mz7nIUMHYxsgkwejBGMK5iZAAAR23JSicBAAA"|"Lancang river bank Resort"|"Xishuangbanna"|"36"|"4.6"|"Near Kongque Avenue (Jingzai Zhai), Jinghong, Yunnan, China"|"[""https://ak-d.tripcdn.com/images/200m0i00000098ebzB2C9_R_600_400_R5_D.jpg_.webp"", ""https://ak-d.tripcdn.com/images/200q0v000000jplzqB8EF_R_800_525_R5_D.jpg"", ""https://ak-d.tripcdn.com/images/20050v000000k2zmo2A00_R_800_525_R5_D.jpg""]"|"Wi-Fi in designated areasAirport pickup serviceRestaurantCaféNon-smoking floor"|"Opened: 2018 The Lancang river bank Resort is an ideal spot for travelers wanting to discover the city. Visitors to Jinghong will find that the Lancang river bank Resort is a fantastic accommodation choice."|"trip.com"
"https://us.trip.com/hotels/xishuangbanna-hotel-detail-73284475/jianglu-nannuo-mountain-inn/?cityId=21474&checkIn=2022-01-22&checkOut=2022-01-23&adult=2&children=0&crn=1&ages=&travelpurpose=0&curr=USD&link=title&hoteluniquekey=H4sIAAAAAAAAAOPazMjFK8Fk8B8GGIWYOBil5jJyzLy79zOzwUdmi1sRjgwgoDDZwRPMYJjmEMAziVGKE8YTNAaBzZMcnNg4dq9llGCZwfj72w-ljYwQBekOOxiZDjAynWA8yLiA6d2PH0q7mKAKDzGxclwQk2A5xcRwiYnhFhPDIyaGV0wMn5gYfsGUNDEzdDEzTGKGKJzFzLCImUGIFew6KQULU7Nk89SUpFSj5DQTY6O0xJTkRAOjZIOUxFRTi2RLSwVujUcPV_azGTFYMUsxunkwBrGZurqZGJhHyXAxO_tFCkJc-MFeijk02EUx6uvOW12xkg5JrKl5uqHBGXc5Chi7GNkEGD0YIxhXMTIAAMwo5qguAQAA"|"JiangLu Nannuo Mountain Inn"|"Xishuangbanna"|"193"|"4.9"|"No.98 Guniangzhai Villager Group, Nannuoshan Village, Gelanghe Township, Menghai, Yunnan, China"|"[""https://ak-d.tripcdn.com/images/0206b120008joaoa85E13_R_600_400_R5_D.jpg_.webp"", ""https://ak-d.tripcdn.com/images/0206h120008joa1avD372_R_800_525_R5_D.jpg"", ""https://ak-d.tripcdn.com/images/0205q120008joaj4rA441_R_800_525_R5_D.jpg""]"|"Wi-Fi in designated areasAirport pickup serviceRestaurantCaféBar"|"Opened: 2021 The JiangLu Nannuo Mountain Inn was recently opened in 2021, making it a fantastic choice for those staying in Menghai."|"trip.com"
"https://us.trip.com/hotels/xishuangbanna-hotel-detail-72665681/xishuangbanna-maroon-lee-sunrise-hotel/?cityId=309&checkIn=2022-01-22&checkOut=2022-01-23&adult=2&children=0&crn=1&ages=&travelpurpose=0&curr=USD&link=title&hoteluniquekey=H4sIAAAAAAAAAOOazcTFK8Fk8B8GGIWYOBilWpk47i882cpicSvCkQEE9i128AQzpi13COApBDNntDs0Mp49AwQ8LQ6TGOM5waI1ax0EwQyBlQ5KzhxTnndzC3BJ7Hu7WVKBUROmzxDGsFBwhJngCWMEsXL8j5FgiWLj2P3AVoLDiY3j1wVmCZYZjBenXFZawci4kRGs-0Cdww5GlgOMLCcY-5gXMN07fllpFxNU7SEmVo7LNhIsp5gYLjEx3GJieMQEMfQVE8MnJqjBv2Cqm5gZupgZJjFD9MxihihdxMwgxAoOBSkFC1OzZPPUlKRUo-Q0E2OjtMSU5EQDo2SDlMRUU4tkS0sFbo1HD1f2sxkxWDFLMbp5MAaxGTqbGrk6RclwMTv7RUJChOGDvRRzaLCLYtTXnbe6YiUdklhT83RDgzPuchQwdjGyCTB6MEYwrmJkAACxAvN1lgEAAA"|"Xishuangbanna Maroon Lee Sunrise Hotel"|"Xishuangbanna"|"393"|"4.7"|"F5-1 of Xishuangjing Jingdai Zhai, Jinghong, Yunnan, China"|"[""https://ak-d.tripcdn.com/images/0201y120008hjj8a8BD70_R_600_400_R5_D.jpg_.webp"", ""https://ak-d.tripcdn.com/images/02001120008hjizcq579B_R_800_525_R5_D.jpg"", ""https://ak-d.tripcdn.com/images/02008120008hjj83e4E7C_R_800_525_R5_D.jpg""]"|"Wi-Fi in designated areasAirport pickup serviceRestaurantCaféNon-smoking floor"|"Opened: 2021 The Xishuangbanna Maroon Lee Sunrise Hotel is one of the newest hotels in Jinghong, having opened in 2021."|"trip.com"
"https://us.trip.com/hotels/xishuangbanna-hotel-detail-72241441/xishuangbanna-shangli-sunshine-elite-resort-hotel/?cityId=309&checkIn=2022-01-22&checkOut=2022-01-23&adult=2&children=0&crn=1&ages=&travelpurpose=0&curr=USD&link=title&hoteluniquekey=H4sIAAAAAAAAAOPazMTFK8Fk8B8GGIWYOBil5jJxnD21cQaLxa0IRwYQeJDp4AljBPAUgpkNEQ6NjD8Nn61TPRHmMImxl5ETLCxQ7CD4sEpknfvJPAclXY6Pzf1cAioSn-60iytwWFxgcpTWv6vCtlDDwRPGCGKIYuO4PZ1RgkPJmePp3LfcAtwSr_rWyCgwasLsMYQxLBQdRXu8XrFsCXbwhDGCWDlmMUowAQ35fYpdgsOJleMhswTTDMaFi3YqrWBk3MHIdICR6QSj4gKmO8t2Ku1igsgfYmI4xcRwiYnhFhPDIyaIEa-YGD4xsXFce8QhwfELqq6JmaGLmWESM8MsZoiiRcwMQqzg0JFSsDA1SzZPTUlKNUpOMzE2SktMSU40MEo2SElMNbVItrRU4NZ49HBlP5sRgxWzFKObB2MQm5GZq6GFUZQMF7OzX6Qg2F8MH-ylmEODXRSjvu681RUr6ZDEmpqnGxqccZejgLGLkU2A0YMxgnEVIwMAkFyfKa4BAAA"|"Xishuangbanna Shangli Sunshine Elite Resort Hotel"|"Xishuangbanna"|"31"|"4.7"|"No.5, East zhuangmu Road, zone 2  tourist resort, Jinghong, Yunnan, China"|"[""https://ak-d.tripcdn.com/images/02043120008gyk2we122E_R_600_400_R5_D.jpg_.webp"", ""https://ak-d.tripcdn.com/images/02026120008gyjqn5FCE2_R_800_525_R5_D.jpg"", ""https://ak-d.tripcdn.com/images/0203y120008gyjxh8A93B_R_800_525_R5_D.jpg""]"|"Wi-Fi in designated areasRestaurantCaféBarNon-smoking floor"|"Opened: 2021 Opened in 2021, the Xishuangbanna Shangli Sunshine Elite Resort Hotel offers travelers a pleasant stay in Jinghong, whether for business or leisure purposes."|"trip.com"
"https://us.trip.com/hotels/dali-hotel-detail-1685929/yunzhongyin-erhaibanshan-villa-haijing-huayuan-holiday-hotel/?cityId=36&checkIn=2022-01-22&checkOut=2022-01-23&adult=2&children=0&crn=1&ages=&travelpurpose=0&curr=USD&link=title&hoteluniquekey=H4sIAAAAAAAAAOP6ycjFK8Fk8B8GGIWYOBilHjNydN19cJjJkQEEBEodPGGMAJ5CMNMh1KGR8b5_7_S8ogCHSYzxnGDRhCoHweuLC2y5-ksclFw4rl2bySnAJXF383JRBUZNmD5DGMPiCbcjzAhPGCOIlWMzlwRLFBvHgVVsEhxOrBz_jSVYZjCu_Jy2g5HpBKPpAqaOxaW7mCDih5gYTjExXGJiuMXE8IgJovUVE8MnJqj2X1B1TcwMXcwMk5gZZjFDFC1iZhBiBftRSsHMMNHcLMnYwNzUJM3EJNnQwsLI1NzIxNzYICnRyMDMUoFbY_Pjlf1sRgxWzFKMbh6MQWyORiZOjpZRMlzMzn6RgmAPMXywl2IODXZRjPq681ZXrKRDEmtqnm5ocMZdjgLGLkY2AUYPxgjGVYwMAHf6loh0AQAA"|"Yunzhongyin Erhaibanshan Villa Haijing Huayuan Holiday Hotel"|"Dali"|"53"|"4.7"|"Erhai Legend B39, East Ring Erhai Road, Dali, 671000, Yunnan, China"|"[""https://ak-d.tripcdn.com/images/200k0y000000m8fknE68A_R_600_400_R5_D.jpg_.webp"", ""https://ak-d.tripcdn.com/images/02009120008nnva9y8700_R_800_525_R5_D.jpg"", ""https://ak-d.tripcdn.com/images/0204a120008qw0cvhFEC0_R_800_525_R5_D.jpg""]"|"Wi-Fi in designated areasAirport pickup serviceRestaurantCaféBar"|"Opened: 2015 Renovated in 2019, the Yunzhongyin Erhaibanshan Villa Haijing Huayuan Holiday Hotel is a great choice for accommodation in Dali."|"trip.com"
"https://us.trip.com/hotels/dali-hotel-detail-2142046/liuyue-wusuo-seaview-holiday-hotel-dali-erhai-shuanglang/?cityId=36&checkIn=2022-01-22&checkOut=2022-01-23&adult=2&children=0&crn=1&ages=&travelpurpose=0&curr=USD&link=title&hoteluniquekey=H4sIAAAAAAAAAON6wsjFK8Fk8B8GGIWYOBilzjFyXFt65hSzIwMImExw8AQzXkx2COApBDMFGh0mMdpxgtkFcxyUtDlur_7ELcAtseTZThkFRk2YIkMYw0IxiJVjsbMESxSDExvH3AeMEiwzGO_da2LcyAhWsiDXYQcj0wFGphOMixkXMD0Ayuxigio8xMTKsUBWguUUE8MlJoZbTAyPmCBmvWJi-MTE8AumromZoYuZYRIzRPUsZoiiRcwMQqxg70gpmBkmmpslGRuYm5qkmZgkG1pYGJmaG5mYGxskJRoZmFkqcGtsfryyn82IwYpZitHNgzGIzcnY1MncKEqGi9nZL1IQ7FaGD_ZSzKHBLopRX3fe6oqVdEhiTc3TDQ3OuMtRwNjFyCbA6MEYwbiKkQEAF1lBK18BAAA"|"Liuyue Wusuo Seaview Holiday Hotel (Dali Erhai Shuanglang)"|"Dali"|"163"|"4.9"|"Near Huanhai Road (Group 4, Shuanglang Village), Dali, 671000, Yunnan, China"|"[""https://ak-d.tripcdn.com/images/200j1b000001b6it92FD4_R_600_400_R5_D.jpg_.webp"", ""https://ak-d.tripcdn.com/images/20021b000001bs0iv4FC0_R_800_525_R5_D.jpg"", ""https://ak-d.tripcdn.com/images/200310000000pcolx9E25_R_800_525_R5_D.jpg""]"|"Wi-Fi in designated areasAirport pickup serviceRestaurantBarNon-smoking floor"|"Opened: 2018 The Liuyue Wusuo Seaview Holiday Hotel (Dali Erhai Shuanglang) is an ideal spot for travelers wanting to discover the city. The Liuyue Wusuo Seaview Holiday Hotel (Dali Erhai Shuanglang) offers a pleasant stay in Dali for those traveling for business or leisure."|"trip.com"
"https://us.trip.com/hotels/dali-hotel-detail-1922402/cube-sugar-hotel/?cityId=36&checkIn=2022-01-22&checkOut=2022-01-23&adult=2&children=0&crn=1&ages=&travelpurpose=0&curr=USD&link=title&hoteluniquekey=H4sIAAAAAAAAAOPqZ-LilWAy-A8DjEJMHIxSPxk5Tr752sNocFDAkQEEGtIcPMGMBTkOATyFYGZCkkMj45ICW67ri2MdJjHGcUJUljsIghkMxQ5KzhybTh7nFOCW6D05UUyBUROmzxDGsFB0hJngCWMEsXJ0CkmwRLFxXN7CLcHhxMqxUk-CZQbjo1WlGxkhdng47GBkOsEos4DpyarSXUwQFYeAdCubBMspJoZLTAy3mBgeMUFMesXE8IkJatovqOImZoYuZoZJzBAts5ghKhcxMwixgn0upWBmmGhulmRsYG5qkmZikmxoYWFkam5kYm5skJRoZGBmqcCtsfnxyn42IwYrZilGNw_GIDYTc2cXI8soGS5mZ79IaCh8sJdiDg12UYz6uvNWV6ykQxJrap5uaHDGXY4Cxi5GNgFGD8YIxlWMDAC9omd8igEAAA"|"Cube Sugar Hotel"|"Dali"|"28"|"4.7"|"No.215 Lvyu Road, Dali, Yunnan, China"|"[""https://ak-d.tripcdn.com/images/200812000000rliem9230_R_600_400_R5_D.jpg_.webp"", ""https://ak-d.tripcdn.com/images/02039120008btsoup50BC_R_800_525_R5_D.jpg"", ""https://ak-d.tripcdn.com/images/200610000000pk14cA670_R_800_525_R5_D.jpg""]"|"Wi-Fi in designated areasAirport pickup serviceBarNon-smoking floorFront desk (24 hours)"|"Opened: 2018 The Cube Sugar Hotel was recently renovated in 2019, making it a fantastic choice for those staying in Dali."|"trip.com"
"https://us.trip.com/hotels/dali-hotel-detail-5499984/wanruo-guli-yunshu-seaview-inn-dali-shuanglang/?cityId=36&checkIn=2022-01-22&checkOut=2022-01-23&adult=2&children=0&crn=1&ages=&travelpurpose=0&curr=USD&link=title&hoteluniquekey=H4sIAAAAAAAAAOOazsTFK8Fk8B8GGIWYOBilGpk4JqycKOHIAAIssxw8wYwf8x0CeArBzIxuh0ZGMEuj3WESYzwnmH1tmYMgmOGz2EHJmWPJhPfcAtwSG9ZulFFg1ITpM4QxLBQdYSZ4whhBrBytORIsUWwcXyawS7A5sXH0vWCSYJnBeOHGeaYVjIwbIZZeKHfYwch0gJHpBGM70wKmS0DJXUxQtYeYWDn-6EmwnGJiuMTEcIuJ4RETxNBXTAyfmKAG_4KpbmJm6GJmmMQM0TOLGaJ0ETODEAsoBKQUzAwTzc2SjA3MTU3STEySDS0sjEzNjUzMjQ2SEo0MzCwVuDU2P17Zz2bEYMUsxejmwRjE5mJkYe5iESXDxezsFwkJEIYP9lLMocEuilFfd97qipV0SGJNzdMNDc64y1HA2MXIJsDowRjBuIqRAQD-jtDskQEAAA"|"Wanruo Guli Yunshu Seaview Inn Dali Shuanglang"|"Dali"|"241"|"4.9"|"No.105 Group 3, Dajianpang Village, Dali, 671009, Yunnan, China"|"[""https://ak-d.tripcdn.com/images/200d1900000182yba1DD6_R_600_400_R5_D.jpg_.webp"", ""https://ak-d.tripcdn.com/images/200e10000000piooeB40E_R_800_525_R5_D.jpg"", ""https://ak-d.tripcdn.com/images/0200a120008apq8zz8DE3_R_800_525_R5_D.jpg""]"|"Wi-Fi in designated areasAirport pickup serviceRestaurantCaféBar"|"Opened: 2016 The Inn is located just across the Small Hill from the heart of the Kingdom of Nanzhao island resort. With a panoramic view of Erhai Lake, Cangshan and a quiet and artistic environment, it is an ideal place for a holiday. The hotel is about 10 minutes'walk from Yujidao Palace of the sun, about 1 minute's walk to many famous restaurants, and about 2 minutes'walk to the Erhai Lake side. [ drive to ] a large car park next to the INN. It is about a minute walk away. The housekeeper is responsible for the baggage drop-off. Designed by a well-known local Bai ethnic architect (Mr. Octogenarian) , the villa offers a stunning 270-degree mirror-like view of the sea from the rooftop. Lohas, new weekly, southern people weekly and other media have recommended and reported, has been in 2016""network Red Hotel Alliance"" , 2018""network Red Hotel"" , the first group of strict selection of lodging members, home-stay headlines and geometric home-stay inn."|"trip.com"
