"link"|"place_name"|"city_name"|"price_by_night"|"rating"|"address"|"images"|"amenities"|"description"|"thirdparty"
"https://us.trip.com/hotels/hangzhou-hotel-detail-1082182/landison-resort-tonglu/?cityId=460&checkIn=2022-01-22&checkOut=2022-01-23&adult=2&children=0&crn=1&ages=&travelpurpose=0&curr=USD&link=title&hoteluniquekey=H4sIAAAAAAAAAONazsjFK8Fk8B8GGIWYOBilJjJynHy2oZfZkQEEGmodPMGMHw0OATyTGCU5YTzBs2eA4EaNgxMrx2cnCZYZjMfanDYygqUPBDrsYGQ6wMh0gtFrAdOntUa7mCCKDgHpuxwSLKeYGC4xMdxiYnjExPCKieETE8MvqIomZoYuZoZJzBB1s5gZFjEzCLGCXSSlYJSYamxiYZKWbGaZaJJoaGSZmGZkkJJqbGGUaG5pbJCowK1x78rKfjYjBitmKUY3D8YgNjNLA1Mn5ygZLmZnv0hBsOsYPthLMYcGuyhGfd15qytW0iGJNTVPNzQ44y5HAWMXI5sAowdjBOMqRgYAVJGbTCIBAAA"|"Landison Resort Tonglu"|"Hangzhou"|"74"|"4.6"|"No.1 Jinzhong Road, Chengnan Street, Tonglu, 311500, Zhejiang, China"|"[""https://ak-d.tripcdn.com/images/200u0q000000gmr2pA6E9_R_600_400_R5_D.jpg_.webp"", ""https://ak-d.tripcdn.com/images/fd/hotel/g4/M06/64/7C/CggYHVYHg1iAZQOvABghbXZEEJ8372_R_800_525_R5_D.jpg"", ""https://ak-d.tripcdn.com/images/0203l1200083d7n1gA71C_R_800_525_R5_D.jpg""]"|"Wi-Fi in designated areasRestaurantNon-smoking floorFront desk (24 hours)Wake-up call"|"Opened: 2015 The Landison Resort Tonglu is an ideal spot for travelers wanting to discover the city. Visitors to Tonglu will find that the Landison Resort Tonglu is a fantastic accommodation choice."|"trip.com"
"https://us.trip.com/hotels/hangzhou-hotel-detail-607717/peninsula-kaihao-hotel/?cityId=658&checkIn=2022-01-22&checkOut=2022-01-23&adult=2&children=0&crn=1&ages=&travelpurpose=0&curr=USD&link=title&hoteluniquekey=H4sIAAAAAAAAAONazcjFK8Fk8B8GGIWYOBilpjJyfJnGZdDB48gAAhMqHTzBjIRahwCeSYySnDCeIJjxo8LBiZXji6UEywzGp92qKxgZNzKCJRr8HHYwMh1gZDrB6LCAqf0e8y4miLpDQPo4uwTLKSaGS0wMt5gYHjExvGJi-MTE8AuqoomZoYuZYRIzRN0sZoZFzAxCzEBXSSkYJaYam1iYpCWbWSaaJBoaWSamGRmkpBpbGCWaWxobJCpwa9y7srKfzYjBilmK0c2DMYjN3NDYzdgiSoaL2dkvEuJohg_2UsyhwS6KUV933uqKlXRIYk3N0w0NzrjLUcDYxcgmwOjBGMG4ipEBAEdTnd8kAQAA"|"Peninsula Kaihao Hotel"|"Hangzhou"|"64"|"4.6"|"No.688 Xin'an East Road, Jiande, 311600, Zhejiang, China"|"[""https://ak-d.tripcdn.com/images/200516000000zc2dg2957_R_600_400_R5_D.jpg_.webp"", ""https://ak-d.tripcdn.com/images/200q0k000000bw3pd284E_R_800_525_R5_D.jpg"", ""https://ak-d.tripcdn.com/images/200i13000000tviopE107_R_800_525_R5_D.jpg""]"|"Wi-Fi in designated areasRestaurantNon-smoking floorCurrency exchangeFront desk (24 hours)"|"Opened: 2008 The Jiande Peninsula Kaihao Hotel (Jiande Bandao Kaihao Dajiudian) is located by the Xin'an River. Downtown Xin'anjiang Square and Jiande Railway Station are within easy reach.

This Jiande hotel houses various comfortable and elegant rooms, all equipped with central air conditioning, international direct-dial phones, LCD TVs, electronic safes and mini bars. The hotel also offers a non-smoking floor and ladies floor.

For dining, this Jiande hotel has a Chinese restaurant, a Western restaurant, a coffeehouse and a lobby bar. Other hotel facilities include a multifunctional hall, conference halls and a business center.

For recreation, there is a fitness center, a beauty salon, games rooms and a gift shop. Ticketing, postal, currency exchange and airport pick-up services are available."|"trip.com"
"https://us.trip.com/hotels/hangzhou-hotel-detail-346300/jw-marriott-hotel-hangzhou/?cityId=17&checkIn=2022-01-22&checkOut=2022-01-23&adult=2&children=0&crn=1&ages=&travelpurpose=0&curr=USD&link=title&hoteluniquekey=H4sIAAAAAAAAAONawcjFK8Fk8B8GGIWYOBilJjFyLJ3zdRWLxaVyRwYQ-NDh4AlmSPQ6BPBMYpTkhPEEwYyATgcnVo6bRRIsMxj3TBTdyAgWXZDgsIOR6QRj3QKm282dGruYIEoOAemLjBJMp5gYLjEx3GJieMTE8IqJ4RMTwy-oiiZmhi5mhknMEHWzmBkWMTMIsYKdJKVglJhqbGJhkpZsZplokmhoZJmYZmSQkmpsYZRobmlskKjArXHvysp-NiMGK2YpRjcPxiA2VzNTF0e3KBkuZme_SIiLGT7YSzGHBrsoRn3deasrVtIhiTU1Tzc0OOMuRwFjFyObAKMHYwTjKkYGACeEvpQjAQAA"|"JW Marriott Hotel Hangzhou"|"Hangzhou"|"126"|"4.7"|"28 Hushu South Road (Hushu Nan Lu), Hangzhou, 310006, Zhejiang, China"|"[""https://ak-d.tripcdn.com/images/20091e000001f1tbp6457_R_600_400_R5_D.jpg_.webp"", ""https://ak-d.tripcdn.com/images/200t1e000001ezgypF228_R_800_525_R5_D.jpg"", ""https://ak-d.tripcdn.com/images/200j1e000001eyy2fE2F3_R_800_525_R5_D.jpg""]"|"Wi-Fi in designated areasRestaurantCaféNon-smoking floorCurrency exchange"|"Opened: 2010 JW Marriott Hangzhou offers unmatched luxurious accommodations. Guest rooms are tastefully designed and appointed with guests' utmost comfort in mind. Deluxe rooms, executive rooms and spacious suites are available to meet every discerning taste. The executive lounge overlooks West Lake with spectacular view of downtown, serves a full breakfast, choice refreshments and delicate snacks throughout the rest of the day. In the evening, cocktails and selected wines are served along with a variety of appetizers, international and local favorite dishes by our culinary team. Four world-class restaurants offer unforgettable culinary experiences. On-site amenities are catered to your home away from home needs such as a relaxing swim at our indoor pool; pamper yourself in our serene Spa or working off your fatigue at our well-equipped fitness center. Our friendly and attentive staff is delighted to serve and will strive to make your stay at Hangzhou an enjoyable and unforgettable experience."|"trip.com"
"https://us.trip.com/hotels/wuyishan-hotel-detail-78037046/impression-thainayural-chatang-hotspring/?cityId=26&checkIn=2022-01-22&checkOut=2022-01-23&adult=2&children=0&crn=1&ages=&travelpurpose=0&curr=USD&link=title&hoteluniquekey=H4sIAAAAAAAAAOOaxMjFK8Fk8B8GGIWYOBilajmu_l44icXiZoQjAwj0THDwhDECeCYxinPCeILGIKDY4-DEzLGccQbjtobZqisYGXcwMp1gXM64gGnV29mqu5hAcoeYGE4xMVxiYrjFxPCIieEVE8MnJoZfYKkmZoYuZoZJzAyzmBkWMTMIsYJtl1KwNEs2NU5MSjIzNTEyMTBPS0xOTTZKSTKwTEwxTUpKTVHg1vhzdWU_mxGDFbMUo5sHYxCbq5mpmaN5lAwXs7NfpCDYlQwf7KWYQ4NdFKO-7rzVFSvpkMSamqcbGpxxl6OAsYuRTYDRgzGCcRUjAwAGAMR8DQEAAA"|"IMPRESSION·THAINAYURAL CHATANG HOTSPRING"|"Xiamen"|"167"|"4.7"|"No.103 Dawangfeng North Road, Resort, Wuyishan, Fujian, China"|"[""https://ak-d.tripcdn.com/images/0205h120008uw7sg35E96_R_600_400_R5_D.jpg_.webp"", ""https://ak-d.tripcdn.com/images/0202r120008sgknsm819D_R_800_525_R5_D.jpg"", ""https://ak-d.tripcdn.com/images/0205y120008rxdpy8D229_R_800_525_R5_D.jpg""]"|"Wi-Fi in designated areasAirport pickup serviceRestaurantFront desk (24 hours)Wake-up call"|"Opened: 2021 Wuyi impression, natural tea soup hot spring resort hotel is located in wuyishan city king of peaks north wuyi, Seoul hotel covers an area of 20 mu, within the scope of the hotel spa reception of main building built 1 (contain comprehensive reception, bath change clothes, indoor bubble pool area 3600 square), don't be wild type soup yuan six buildings, were set up high-end spa room (with a sweet garden spa pool, Also with romantic balcony or terrace soaking pool), indoor and outdoor soaking pool is equipped with tea tasting area; There are 26 outdoor pools and 1 central garden and landscape swimming pool in an outdoor area of about 6,000 square meters. Built by Mount Wuyi Impression Dahongpao with great effort, it is operated and managed by Fuzhou Tainature, which is also the first hot spring resort in Mount Wuyi. Relying on the impression dahongpao and tea culture industry, the project truly realizes the transformation and transition from the traditional travel route of ""climbing to the sky and taking a bamboo raft"" to the new emerging vacation experience of ""appreciating the impression by rock tea and soaking in hot spring"". Hot spring park adds rich tea elements, perfect combination of tea culture and hot spring culture; It expresses the inheritance of Wuyishan tea culture and the mood of modern people living in hot spring."|"trip.com"
"https://us.trip.com/hotels/wuyishan-hotel-detail-5992149/jiulongwan-shanshuijian-hotel/?cityId=26&checkIn=2022-01-22&checkOut=2022-01-23&adult=2&children=0&crn=1&ages=&travelpurpose=0&curr=USD&link=title&hoteluniquekey=H4sIAAAAAAAAAOPqZ-LilWAy-A8DjEJMHIxSPxk5Jh_vPsvsyAACByodPMGMDfUOATyFYKZDtkMjI5glk-4wiTGeE8xe0eYgCGY4NTsouXA8f3GQRYBN4uuGiZIKjJowfYYwhsVbRkeYEZ4wRhArx3UmCaYoNo5LTwUlOJxYOVZGSrDMYLx69y3TRoiNB8IddjAynWB0XMB0HSi6iwmi5hCQvswtwXKKieESE8MtJoZHTBCzXjExfGKCmvcLqriJmaGLmWESM0TLLGaIykXMDEKsYJ9LKViaJZsaJyYlmZmaGJkYmKclJqcmG6UkGVgmppgmJaWmKHBr_Lm6sp_NiMGKWYrRzYMxiM3U0cjN2ClKhovZ2S8SEhAMH-ylmEODXRSjvu681RUr6ZDEmpqnGxqccZejgLGLkU2A0YMxgnEVIwMA6DY44IoBAAA"|"Jiulongwan Shanshuijian Hotel"|"Xiamen"|"65"|"4.8"|"No.1 Jiulongke, Dawangfeng Road, Wuyishan, Fujian, China"|"[""https://ak-d.tripcdn.com/images/0205i1200087bd2bn6002_R_600_400_R5_D.jpg_.webp"", ""https://ak-d.tripcdn.com/images/0202p1200081h2u713DDB_R_800_525_R5_D.jpg"", ""https://ak-d.tripcdn.com/images/0202p12000847jmcaAA15_R_800_525_R5_D.jpg""]"|"Wi-Fi in designated areasAirport pickup serviceRestaurantNon-smoking floorFront desk (24 hours)"|"Opened: 2016 The Jiulongwan Shanshuijian Hotel is an ideal spot for travelers wanting to discover the city. Visitors to Wuyishan will find that the Jiulongwan Shanshuijian Hotel is a fantastic accommodation choice."|"trip.com"
"https://us.trip.com/hotels/wuyishan-hotel-detail-48563468/wyndham-garden-wuyishan/?cityId=26&checkIn=2022-01-22&checkOut=2022-01-23&adult=2&children=0&crn=1&ages=&travelpurpose=0&curr=USD&link=title&hoteluniquekey=H4sIAAAAAAAAAOOawsTFK8Fk8B8GGIWYOBil_jFyPN5xqInF4maEIwMICJQ5eIIZF6ocAngKwUyHOIdGRluu64sL9kY6TGKM4wSLGjQ6CEKkax2UnDk-rN3PLcAm8eb4FGkFRk2YPkMYw4LVEWaCJ4wRxMrxlU-CJYqNY9cXTgkOJ1aOh84SLDMYe7qmiK9gZNzICNbMEOywg5HpBKPFAqZ-oMQuJoiyQ0B6DacEyykmhktMDLeYGB4xQYx7xcTwiQlq5C-o4iZmhi5mhknMEC2zmCEqFzEzCLGCvS-lYGmWbGqcmJRkZmpiZGJgnpaYnJpslJJkYJmYYpqUlJqiwK3x5-rKfjYjBitmKUY3D8YgNjMnc2cXyygZLmZnv0hIUDB8sJdiDg12UYz6uvNWV6ykQxJrap5uaHDGXY4Cxi5GNgFGD8YIxlWMDAC_vW7kjwEAAA"|"Wyndham Garden Wuyishan"|"Xiamen"|"56"|"4.6"|"No.5 Jiuquxi Road, Wuyishan, Fujian, China"|"[""https://ak-d.tripcdn.com/images/0204u120008jv52pb2E8C_R_600_400_R5_D.jpg_.webp"", ""https://ak-d.tripcdn.com/images/0206w120000277h7mEC3D_R_800_525_R5_D.jpg"", ""https://ak-d.tripcdn.com/images/02027120008jv52pg2151_R_800_525_R5_D.jpg""]"|"Wi-Fi in designated areasAirport pickup serviceRestaurantCaféNon-smoking floor"|"Opened: 2014 The Wyndham Garden Wuyishan is one of the newest hotels in Wuyishan, having been renovated in 2019."|"trip.com"
"https://us.trip.com/hotels/wuyishan-hotel-detail-65147671/yutopia-wuyi-mountain-retreat/?cityId=26&checkIn=2022-01-22&checkOut=2022-01-23&adult=2&children=0&crn=1&ages=&travelpurpose=0&curr=USD&link=title&hoteluniquekey=H4sIAAAAAAAAAOPaxMjFK8Fk8B8GGIWYOBil5jBy9LWsnM9isa7YkQEIGrYecfAEMRguHncI4JnEKMUJ4wmCGR2HHZzYOJbe45ZgmcE4fVmH_EZGsPidGQ47GFkOMLKcYOzgXcD07dV-lV1MUIWHgIxfhxklWE4xMVxiYrjFxPCIieEVE8MnJoZfMDVNzAxdzAyTmKEqZzEzLGJmEGIFO05KwdIs2dQ4MSnJzNTEyMTAPC0xOTXZKCXJwDIxxTQpKTVFgVvjz9WV_WxGDFbMUoxuHoxBbG6Olq5mRlEyXMzOfpEQtzN8sJdiDg12UYz6uvNWV6ykQxJrap5uaHDGXY4Cxi5GNgFGD8YIxlWMDADFlw6pLQEAAA"|"Yutopia Wuyi Mountain Retreat"|"Xiamen"|"1"|"4.7"|"No.80 Fulongyan, Wuyi Mountain Resort, Wuyishan, Fujian, China"|"[""https://ak-d.tripcdn.com/images/0202i120008olhxnzCFE3_R_600_400_R5_D.jpg_.webp"", ""https://ak-d.tripcdn.com/images/0201b120008cn0fhy060A_R_800_525_R5_D.jpg"", ""https://ak-d.tripcdn.com/images/02064120008crzvkb9391_R_800_525_R5_D.jpg""]"|"Wi-Fi in designated areasAirport shuttle serviceAirport pickup serviceRestaurantCafé"|"Opened: 2020 Opened in 2020, the Yutopia Wuyi Mountain Retreat offers travelers a pleasant stay in Wuyishan, whether for business or leisure purposes."|"trip.com"
"https://us.trip.com/hotels/wuyishan-hotel-detail-45866790/houtang-garden-hotel/?cityId=26&checkIn=2022-01-22&checkOut=2022-01-23&adult=2&children=0&crn=1&ages=&travelpurpose=0&curr=USD&link=title&hoteluniquekey=H4sIAAAAAAAAAONqYeLilWAy-A8DjEJMHIxS7xg5Tm3e1cFk0MljcSvCkQEEHnQ6eMIYATyFEGamQyMjmOWQ6jCJMY4TzNaZ4CAIZkzoclBy5pj45AqLAJfE_UM_ORQYNWH6DGEMCwVHmAmeMEYQK8dBSQmWKDaOjesEJDicgNx6CZYZjMv2vRfdwch0gJHpBGMz4wKmVUD-LiaI7CEmhlNMDJeYGG4xMTxighjwionhExPUkF9QdU3MDF3MDJOYGWYxQxQtYmYQYgV7V0rB0izZ1DgxKcnM1MTIxMA8LTE5NdkoJcnAMjHFNCkpNUWBW-PP1ZX9bEYMVsxSjG4ejEFsFo6OTk5uUTJczM5-kRB_M3ywl2IODXZRjPq681ZXrKRDEmtqnm5ocMZdjgLGLkY2AUYPxgjGVYwMAKcCBfp_AQAA"|"Houtang Garden Hotel"|"Xiamen"|"126"|"4.7"|"Building 11, Yunqing resort, No. 16, Golf Road, Sangu Resort, Wuyishan, Fujian, China"|"[""https://ak-d.tripcdn.com/images/200n1700000113pc5A271_R_600_400_R5_D.jpg_.webp"", ""https://ak-d.tripcdn.com/images/2001180000015scrm2EC8_R_800_525_R5_D.jpg"", ""https://ak-d.tripcdn.com/images/200e180000015i6jmB493_R_800_525_R5_D.jpg""]"|"Wi-Fi in designated areasAirport pickup serviceRestaurantNon-smoking floorFront desk (24 hours)"|"Opened: 2019 The Houtang Garden Hotel is one of the newest hotels in Wuyishan, having opened in 2019."|"trip.com"
"https://us.trip.com/hotels/zhangjiajie-hotel-detail-15848480/yuxi-hotel/?cityId=27&checkIn=2022-01-22&checkOut=2022-01-23&adult=2&children=0&crn=1&ages=&travelpurpose=0&curr=USD&link=title&hoteluniquekey=H4sIAAAAAAAAAONaycjFK8Fk8B8GGIWYOBilJjNyrF9yM8HgJbMjAwg8yHTwBDMO5DoE8ExilOSE8QRnzQQCz0wHJ1aOlbISLDMYF6w4zr6CkXEjI1gJg73DDkamE4yKC5gWASV2MUGUHWJi4TCUYDrFxHCJieEWE8MjJoZXTAyfmBh-QRU0MTN0MTNMYgYrm8XMsIiZQYgF5CYphVTjVMsUo6SUNJMUM5M0UxMLMwOztFRLyzQLixTzJMM0BW6NyddX9rMZMVgxSzG6eTAGsbkaGxgauETJcDE7-0UKQhz2wV6KOTTYRTHq685bXbGSDkmsqXm6ocEZdzkKGLsY2QQYPRgjGFcxMgAA2nVTRSMBAAA"|"Yuxi Hotel"|"Zhangjiajie"|"33"|"4.9"|"Lane 9, Baofeng Road, Zhangjiajie, Hunan, China"|"[""https://ak-d.tripcdn.com/images/0206512000930mj9v19A5_R_600_400_R5_D.jpg_.webp"", ""https://ak-d.tripcdn.com/images/020371200092v4vzj853F_R_800_525_R5_D.jpg"", ""https://ak-d.tripcdn.com/images/020371200092v4vzj853F_R_800_525_R5_D.jpg""]"|"Wi-Fi in designated areasAirport pickup serviceRestaurantFront desk (24 hours)Wake-up call"|"Opened: 2018 The Yuxi Hotel is an ideal spot for travelers wanting to discover the city. The Yuxi Hotel offers a pleasant stay in Zhangjiajie for those traveling for business or leisure."|"trip.com"
"https://us.trip.com/hotels/zhangjiajie-hotel-detail-24273151/meiyi-light-luxury-mingsu-hotel-zhangjiajie-dayong-ancient-city-store/?cityId=27&checkIn=2022-01-22&checkOut=2022-01-23&adult=2&children=0&crn=1&ages=&travelpurpose=0&curr=USD&link=title&hoteluniquekey=H4sIAAAAAAAAAOP6y8jFK8Fk8B8GGIWYOBilnjNyrF3xeSWLIwMINKQ4eMIYATyFYOaBQIdGxjQQ-ObrMIkxjhMsmpDrIAhm_MhwUHLmaJz8hEmAS-LB2f8CCoyaMH2GMIaFgiPMBE8YI4iV4waHBEsUG8eiR6wSHE6sHL9kJFhmMP4_eJJ7BSPjDkamE4xSC5gaD53k3sUEkTzExHCKieESE8MtJoZHTBD9r5gYPjFBzfgFVdfEzNDFzDCJmWEWM0TRImYGIVawP6UUUo1TLVOMklLSTFLMTNJMTSzMDMzSUi0t0ywsUsyTDNMUuDUmX1_Zz2bEYMUsxejmwRjEZuFiamDmHCXDxezsFwnxNsMHeynm0GAXxaivO291xUo6JLGm5umGBmfc5Shg7GJkE2D0YIxgXMXIAADE35q9eAEAAA"|"Meiyi Light Luxury Mingsu Hotel (Zhangjiajie Dayong Ancient City Store)"|"Zhangjiajie"|"28"|"4.8"|"Building 17A, Unit 2, Building 2, Dongfang Square, intersection of Yingbin Road and Jiefang Road, Zhangjiajie, Hunan, China"|"[""https://ak-d.tripcdn.com/images/0202r120008lbtmcs228E_R_600_400_R5_D.jpg_.webp"", ""https://ak-d.tripcdn.com/images/200k0x000000l9zavAC8C_R_800_525_R5_D.jpg"", ""https://ak-d.tripcdn.com/images/200k0x000000l9zavAC8C_R_800_525_R5_D.jpg""]"|"Wi-Fi in designated areasAirport pickup serviceFront desk (24 hours)Wake-up callLuggage storage"|"Opened: 2018 The Meiyi Light Luxury Mingsu Hotel (Zhangjiajie Dayong Ancient City Store) provides a great place for travelers to relax after a busy day. Visitors to Zhangjiajie will find that the Meiyi Light Luxury Mingsu Hotel (Zhangjiajie Dayong Ancient City Store) is a fantastic accommodation choice."|"trip.com"
"https://us.trip.com/hotels/zhangjiajie-hotel-detail-37900142/puyiju-hostel/?cityId=27&checkIn=2022-01-22&checkOut=2022-01-23&adult=2&children=0&crn=1&ages=&travelpurpose=0&curr=USD&link=title&hoteluniquekey=H4sIAAAAAAAAAOPawMjFK8Fk8B8GGIWYOBilZjFyTHkyZTaLxa0IRwYQuDLbwRPMYFjgEMAziVGKE8YTvL64wJbr-kwHJzaOFX8YJVhmML6b1ym0kREsv6HAYQcjywFGlhOMM5kWMH0Eyuxigio8xMTK8VVBguUUE8MlJoZbTAyPmBheMTF8YmL4BVPSxMzQxcwwiRmicBYzwyJmBiFWsNOkFFKNUy1TjJJS0kxSzEzSTE0szAzM0lItLdMsLFLMkwzTFLg1Jl9f2c9mxGDFLMXo5sEYxObm5urk5hglw8Xs7BcpCPHCB3sp5tBgF8WorztvdcVKOiSxpubphgZn3OUoYOxiZBNg9GCMYFzFyAAAEr-jzysBAAA"|"Puyiju Hostel"|"Zhangjiajie"|"281"|"4.8"|"No.043 Zhaizigang Group, Zhangjiajie, Hunan, China"|"[""https://ak-d.tripcdn.com/images/0204m1200097jp30jC1C1_R_600_400_R5_D.jpg_.webp"", ""https://ak-d.tripcdn.com/images/200p14000000x0jua78C5_R_800_525_R5_D.jpg"", ""https://ak-d.tripcdn.com/images/200q1b0000019y80676EA_R_800_525_R5_D.jpg""]"|"Wi-Fi in designated areasAirport pickup serviceRestaurantCurrency exchangeFront desk (24 hours)"|"Opened: 2019 The Puyiju Hostel is one of the newest hotels in Zhangjiajie, having opened in 2019."|"trip.com"
"https://us.trip.com/hotels/zhangjiajie-hotel-detail-38809196/shell-youth-holiday-hotel-zhangjiajie-national-forest-park/?cityId=27&checkIn=2022-01-22&checkOut=2022-01-23&adult=2&children=0&crn=1&ages=&travelpurpose=0&curr=USD&link=title&hoteluniquekey=H4sIAAAAAAAAAOOaxMTFK8Fk8B8GGIWYOBil_jByNE1oOMboyAACCSkOnmCGQqZDAE8hmHkg1KGRsV3s5rnv0UEOkxjjOcGiDEUOgg-rRNa5z8xzUHLheHH1CZMAm8SKSe2SCoyaMH2GMIbFW0ZHmBGeMEYQK8dlLgmWKDaOex3sEhxOrBz7lCVYZjC-uXNAaCMjxBZnhx2MTAcYmU4wSi1g2nz3gNAuJoiyQ0D6AosEyykmhktMDLeYGB4xQYx7xcTwiQlq5C-o4iZmhi5mhknMEC2zmCEqFzEzCLGCPS-lkGqcaplilJSSZpJiZpJmamJhZmCWlmppmWZhkWKeZJimwK0x-frKfjYjBitmKUY3D8YgNktHSxdH4ygZLmZnv0hBiHM_2Esxhwa7KEZ93XmrK1bSIYk1NU83NDjjLkcBYxcjmwCjB2ME4ypGBgAoZHrBjQEAAA"|"Shell Youth Holiday Hotel（Zhangjiajie National Forest Park ）"|"Zhangjiajie"|"26"|"4.8"|"No.149-10 Ziyuan Road, Zhangjiajie, Hunan, China"|"[""https://ak-d.tripcdn.com/images/200s170000011ogehEDD5_R_600_400_R5_D.jpg_.webp"", ""https://ak-d.tripcdn.com/images/200h170000011j5dr3A0B_R_800_525_R5_D.jpg"", ""https://ak-d.tripcdn.com/images/200e1f000001gu9ihFE95_R_800_525_R5_D.jpg""]"|"Wi-Fi in designated areasAirport pickup serviceRestaurantCaféNon-smoking floor"|"Opened: 2019 Opened in 2019, the Shell Youth Holiday Hotel（Zhangjiajie National Forest Park ） is a great accommodation choice in Zhangjiajie."|"trip.com"
"https://us.trip.com/hotels/zhangjiajie-hotel-detail-43132880/yunmei-bieyuan-hotel/?cityId=27&checkIn=2022-01-22&checkOut=2022-01-23&adult=2&children=0&crn=1&ages=&travelpurpose=0&curr=USD&link=title&hoteluniquekey=H4sIAAAAAAAAAOOaxMTFK8Fk8B8GGIWYOBil_jBy9O9e8YjRkQEEErIdPMGMA_kOATyFYCaDjkMj49kzIKDmMIkxnhOioMBBEMxoyHFQcuGY2_-CSYBN4uakHawKjJowfYYwhsUxNkeYEZ4wRhArxxVGCZYoNo6dPYwSHE6sHE2KEiwzGC-cPyGygpFxIyPEfEeHHYxMJxiVFzC9BUrsYoIoOwSkl7NIsJxiYrjExHCLieERE8S4V0wMn5igRv6CKm5iZuhiZpjEDNEyixmichEzgxAr2PNSCqnGqZYpRkkpaSYpZiZppiYWZgZmaamWlmkWFinmSYZpCtwak6-v7GczYrBilmJ082AMYnM1dLUwNoiS4WJ29ouEhAXDB3sp5tBgF8WorztvdcVKOiSxpubphgZn3OUoYOxiZBNg9GCMYFzFyAAAMu86KI0BAAA"|"Yunmei Bieyuan Hotel"|"Zhangjiajie"|"35"|"4.8"|"No.1 Lane 2, Shuangyong Road, Zhangjiajie, Hunan, China"|"[""https://ak-d.tripcdn.com/images/020351200092ezb95D22B_R_600_400_R5_D.jpg_.webp"", ""https://ak-d.tripcdn.com/images/0202i1200092h1ncf03F6_R_800_525_R5_D.jpg"", ""https://ak-d.tripcdn.com/images/20071d000001f0h1c53B6_R_800_525_R5_D.jpg""]"|"Wi-Fi in designated areasAirport pickup serviceRestaurantNon-smoking floorFront desk (24 hours)"|"Opened: 2019 Opened in 2019, the Yunmei Bieyuan Hotel offers travelers a pleasant stay in Zhangjiajie, whether for business or leisure purposes."|"trip.com"
"https://us.trip.com/hotels/chengdu-hotel-detail-79564980/qisuxi-home-stay/?cityId=7550&checkIn=2022-01-22&checkOut=2022-01-23&adult=2&children=0&crn=1&ages=&travelpurpose=0&curr=USD&link=title&hoteluniquekey=H4sIAAAAAAAAAOOax8TFK8Fk8B8GGIWYOBilOpg4Wpbu7GMx-MhscSvCkQEEGvodPMGMC5McAngKwcwHRQ6NjGAWQ4HDJMZ4TjCzY7qDIERwioOSM0fvh3fcAmwS7U82yCgwasL0GcIYFqyOMBM8YYwgVo7bzBJMUWwcny9KSHA4sXEc3ckowTKDccvCH6orGBk3QixtyHDYwch0gJHpBON8xgVMW4GSu5igag8xsXLMkpBgOcXEcImJ4RYTwyMmiKGvmBg-MUEN_gVT3cTM0MXMMIkZomcWM0TpImYGIVZwQEgpmJqlGKeYGKaYGiYnmSQaJFoYpJmZJpqnJZqlWZilpBoqcGusu7Gyn82IwYpZitHNgzGIzc3Z3NTIPEqGi9nZLxIaIh_spZhDg10Uo77uvNUVK-mQxJqapxsanHGXo4Cxi5FNgNGDMYJxFSMDAHxSxAWZAQAA"|"Qisuxi home stay"|"Chengdu"|"83"|"4.8"|"No.66 Group 1, Xiaoshi Village, Guihua Town, Pengzhou, Sichuan, China"|"[""https://ak-d.tripcdn.com/images/0206b120008wiotffE6D6_R_600_400_R5_D.jpg_.webp"", ""https://ak-d.tripcdn.com/images/0205s120008wirx0n9565_R_800_525_R5_D.jpg"", ""https://ak-d.tripcdn.com/images/0203z120008wis6pc40FB_R_800_525_R5_D.jpg""]"|"Wi-Fi in designated areasRestaurantFront desk (24 hours)Luggage storageKids’ playground"|"Opened: 2021 The Qisuxi home stay is a great choice for guests looking for accommodation in Pengzhou, having been recently opened in 2021."|"trip.com"
"https://us.trip.com/hotels/chengdu-hotel-detail-60187857/dayi-huajian-hotel/?cityId=7716&checkIn=2022-01-22&checkOut=2022-01-23&adult=2&children=0&crn=1&ages=&travelpurpose=0&curr=USD&link=title&hoteluniquekey=H4sIAAAAAAAAAONaycjFK8Fk8B8GGIWYOBilJjNydG1q3clscSvCkQEEDAocPMGMBUUOATyTGCU5YTzBWTOBYGW-gxMrx20VCZYZjBdP3pTZyAiWb3B22MHIdIJRcwHTZaDoLiaImkNA-imLBMspJoZLTAy3mBgeMTG8YmL4xMTwC6qiiZmhi5lhEjNE3SxmhkXMDEKsYDdJKZiapRinmBimmBomJ5kkGiRaGKSZmSaapyWapVmYpaQaKnBrrLuxsp_NiMGKWYrRzYMxiM3JyM3JyTJKhovZ2S9SEOw2hg_2UsyhwS6KUV933uqKlXRIYk3N0w0NzrjLUcDYxcgmwOjBGMG4ipEBADw6SnskAQAA"|"Dayi Huajian Hotel"|"Chengdu"|"41"|"4.3"|"No. 4, Shuixiu Eighth Lane, Shanqing Street, Huashuiwan, Dayi, Sichuan, China"|"[""https://ak-d.tripcdn.com/images/0202p1200082mdhye9361_R_600_400_R5_D.jpg_.webp"", ""https://ak-d.tripcdn.com/images/0202p1200082mdhye9361_R_600_400_R5_D.jpg_.webp"", ""https://ak-d.tripcdn.com/images/0202p1200082mdhye9361_R_600_400_R5_D.jpg_.webp""]"|"Wi-Fi in designated areasFront desk (24 hours)Basketball courtLuggage storage"|"Opened: 2019 The Dayi Huajian Hotel was recently opened in 2019, making it a fantastic choice for those staying in Dayi."|"trip.com"
"https://us.trip.com/hotels/chengdu-hotel-detail-708049/celebrity-city-hotel/?cityId=7744&checkIn=2022-01-22&checkOut=2022-01-23&adult=2&children=0&crn=1&ages=&travelpurpose=0&curr=USD&link=title&hoteluniquekey=H4sIAAAAAAAAAOP6xcjFK8Fk8B8GGIWYOBilnjBy9C9-yubIAAIBVQ6eMEYATyGY2eDu0Mi4pMCW6_pjZ4dJjHGcYFGHWgfBs2eA4E6Fg5Izx5eXx1kF2CQ2b2rgVmDUhOkzhDEsWB1hJnjCGEGsHI9ZJVii2Di6XzFLcDixcjxilWCawXhxtvYORqYDjEwnGJ0WMF2arb2LCSJ1iInhFBPDJSaGW0wMj5ggul8xMXxigprwC6quiZmhi5lhEjPDLGaIokXMDEIsIE9KKZiapRinmBimmBomJ5kkGiRaGKSZmSaapyWapVmYpaQaKnBrrLuxsp_NiMGKWYrRzYMxiM3QzMLMxDFKhovZ2S9SEOwjhg_2UsyhwS6KUV933uqKlXRIYk3N0w0NzrjLUcDYxcgmwOjBGMG4ipEBAHER6Jl0AQAA"|"Celebrity City Hotel"|"Chengdu"|"66"|"4.7"|"158 Financial Street, Central Square (Zhongxin Guangchang), Dongcheng New District, Jianyang, 641400, Sichuan, China"|"[""https://ak-d.tripcdn.com/images/20040m000000dmke66548_R_600_400_R5_D.jpg_.webp"", ""https://ak-d.tripcdn.com/images/200j0m000000dncf55640_R_800_525_R5_D.jpg"", ""https://ak-d.tripcdn.com/images/fd/hotel/g5/M03/BC/4B/CggYr1cXNiWAfblvAAG8YCI56-M391_R_800_525_R5_D.jpg""]"|"Wi-Fi in designated areasAirport pickup serviceRestaurantCaféNon-smoking floor"|"Opened: 2013 Located in Central Square of Dongcheng New District, the Jianyang Celebrity City Hotel (Jianyang Chengshi Mingren Jiudian) is just an 8-minute drive from Jianyang Railway Station.  Business travelers can host meetings and events in the hotel’s on-site conference rooms.  During your leisure time, you can take advantage of the on-site karaoke rooms or take a load off at the teahouse."|"trip.com"
"https://us.trip.com/hotels/chengdu-hotel-detail-54629369/the-mulian-hotel/?cityId=7716&checkIn=2022-01-22&checkOut=2022-01-23&adult=2&children=0&crn=1&ages=&travelpurpose=0&curr=USD&link=title&hoteluniquekey=H4sIAAAAAAAAAOPawMjFK8Fk8B8GGIWYOBilZjFy7Fq-cyqLxc0IRwYQOLXQwRPMKFniEMAziVGKE8YTnDUTCJIWOjixcRw9xCTBMoPx5_I2qY2MYAUBpQ47GJkOMDKdYHzOtICpcUWb1C4mqMJDTKwcnVoSLKeYGC4xMdxiYnjExPCKieETE8MvmJImZoYuZoZJzBCFs5gZFjEzCLGCnSalYGqWYpxiYphiapicZJJokGhhkGZmmmielmiWZmGWkmqowK2x7sbKfjYjBitmKUY3D8YgNiMzAzMDwygZLmZnv0hBsAsZPthLMYcGuyhGfd15qytW0iGJNTVPNzQ44y5HAWMXI5sAowdjBOMqRgYAU34uoSsBAAA"|"The Mulian Hotel"|"Chengdu"|"359"|"4.7"|"No.1000-21 Dongkou Street, Dayi, Sichuan, China"|"[""https://ak-d.tripcdn.com/images/200c1f000001gudqcB3D8_R_600_400_R5_D.jpg_.webp"", ""https://ak-d.tripcdn.com/images/20021f000001gytbwA41F_R_800_525_R5_D.jpg"", ""https://ak-d.tripcdn.com/images/0202n120008xxrgyl39EF_R_800_525_R5_D.jpg""]"|"Wi-Fi in designated areasAirport pickup serviceRestaurantNon-smoking floorFront desk (24 hours)"|"Opened: 2019 The Mulian Hotel is a great choice for guests looking for accommodation in Dayi, having been recently opened in 2019."|"trip.com"
"https://us.trip.com/hotels/chengdu-hotel-detail-6752442/w-chengdu/?cityId=28&checkIn=2022-01-22&checkOut=2022-01-23&adult=2&children=0&crn=1&ages=&travelpurpose=0&curr=USD&link=title&hoteluniquekey=H4sIAAAAAAAAAONaz8jFK8Fk8B8GGIWYOBilZjJyrH127RyzAYcjAwi4THTwBDMUpjgE8ExilOKE8QTlW18H7mic6ODExnF9HqMEywzGXRPnMK9gZNzICFbzIM1hByPTCcZ1jAuYPh7dyL6LCarwEBMrxxkxCZZTTAyXmBhuMTE8YmJ4xcTwiYnhF0xJEzNDFzPDJGaIwlnMDIuYGYRYwS6TUjA1SzFOMTFMMTVMTjJJNEi0MEgzM000T0s0S7MwS0k1VODWWHdjZT-bEYMVsxSjmwdjEJuhpaGrk3mUDBezs1-kINh5DB_spZhDg10Uo77uvNUVK-mQxJqapxsanHGXo4Cxi5FNgNGDMYJxFSMDABieI-AqAQAA"|"W Chengdu"|"Chengdu"|"174"|"4.7"|"Building 1, No. 300 Jiaozi Avenue, Gaoxin District,, Chengdu, Sichuan, China"|"[""https://ak-d.tripcdn.com/images/0202r1200086mow8uE074_R_600_400_R5_D.jpg_.webp"", ""https://ak-d.tripcdn.com/images/0203d120008ds16p40654_R_800_525_R5_D.jpg"", ""https://ak-d.tripcdn.com/images/0200u120008dtjez4A687_R_800_525_R5_D.jpg""]"|"Wi-Fi in designated areasAirport pickup serviceRestaurantCaféBar"|"Opened: 2020 Opened in 2020, the W Chengdu offers travelers a pleasant stay in Chengdu, whether for business or leisure purposes."|"trip.com"
